<?xml version="1.0" encoding="UTF-8"?>
<xs:schema xmlns:xs="http://www.w3.org/2001/XMLSchema">

  <!-- Определение элемента timesheet -->
  <xs:element name="timesheet">
    <xs:complexType>
      <xs:sequence>
        <xs:element name="day" maxOccurs="unbounded">
          <xs:complexType>
            <xs:sequence>
              <xs:element name="tutorial" maxOccurs="unbounded">
                <xs:complexType>
                  <xs:attribute name="subject" type="xs:string" use="required"/>
                  <xs:attribute name="room" type="xs:string" use="required"/>
                  <xs:attribute name="teacher" type="xs:string" use="required"/>
                  <xs:attribute name="start" type="xs:string" use="required"/>
                  <xs:attribute name="end" type="xs:string" use="required"/>
                  <xs:attribute name="type" type="xs:string" use="required"/>
                </xs:complexType>
              </xs:element>
            </xs:sequence>
            <xs:attribute name="name" type="xs:string" use="required"/>
          </xs:complexType>
        </xs:element>
      </xs:sequence>
    </xs:complexType>
  </xs:element>

</xs:schema>